{
  "$schema": "https://json-schema.org/draft/2020-12/schema",
  "$id": "https://raw.githubusercontent.com/JPHutchins/code-review/schema-v0.9.0/schema/findings.schema.json",
  "title": "Code Review \u2014 findings",
  "description": "Structured output of an agentic PR code review. The review agent emits this object (e.g. via a coding-agent CLI's structured-output mode, such as Claude Code's `--json-schema`, whose result lands in `.structured_output`, or a file).",
  "type": "object",
  "additionalProperties": false,
  "required": [
    "schema_version",
    "summary",
    "verdict",
    "findings"
  ],
  "properties": {
    "schema_version": {
      "type": "string",
      "pattern": "^(0|[1-9]\\d*)\\.(\\d+)\\.(\\d+)(?:-[0-9A-Za-z-]+(?:\\.[0-9A-Za-z-]+)*)?(?:\\+[0-9A-Za-z-]+(?:\\.[0-9A-Za-z-]+)*)?$",
      "description": "Semver version of this findings schema the object conforms to (e.g. \"0.1.0\")."
    },
    "summary": {
      "type": "string",
      "description": "1-4 sentence markdown justification of the overall verdict \u2014 the shape of the review and why the verdict follows from it. Do not restate individual findings (those live in `findings`) or cross-cutting observations (those live in `systemic_problems`); the summary explains the verdict, the arrays carry the evidence."
    },
    "verdict": {
      "type": "string",
      "enum": [
        "approve",
        "comment",
        "changes",
        "error"
      ],
      "description": "Overall stance. The review agent emits one of `approve`/`comment`/`changes`. `error` is reserved for the pipeline: it marks a run that produced no verdict about the diff (an operational failure, a security refusal, or an empty diff with nothing to review \u2014 always with `findings: []`), so a consumer switching on `verdict` gets a case it does not recognise rather than a false clean pass."
    },
    "systemic_problems": {
      "type": "array",
      "description": "Zero or more cross-cutting observations that tie several findings together or describe a pattern spanning the change, and are hard to express with a single line range. Omit the field when there are none; the summary must not restate them.",
      "items": {
        "type": "object",
        "additionalProperties": false,
        "required": [
          "title",
          "description",
          "severity",
          "reasoning",
          "confidence",
          "likelihood"
        ],
        "properties": {
          "title": {
            "type": "string",
            "description": "One-line summary of the systemic problem."
          },
          "description": {
            "type": "string",
            "description": "1-3 sentence markdown explanation of the pattern and why it matters \u2014 how it ties the related findings together. Details belong in the individual findings' `reasoning`."
          },
          "severity": {
            "type": "string",
            "enum": [
              "critical",
              "major",
              "minor",
              "nit"
            ],
            "description": "Overall severity of the systemic problem \u2014 the severity of the pattern itself, not of any single finding. It does not count toward the findings severity histogram."
          },
          "reasoning": {
            "type": "string",
            "description": "Rationale/evidence for why the systemic problem holds, so a human or downstream agent can judge its soundness \u2014 distinct from `description`, which explains the pattern to the reader. Mirrors the finding field of the same name."
          },
          "confidence": {
            "type": "number",
            "minimum": 0,
            "maximum": 1,
            "description": "0..1 confidence in the systemic problem itself. Mirrors the finding field of the same name."
          },
          "likelihood": {
            "type": "number",
            "minimum": 0,
            "maximum": 1,
            "description": "Set to 1 for a systemic problem. A structural/cross-cutting observation has no single triggering input \u2014 it is definitionally always present \u2014 so the convergence score treats a systemic problem's likelihood as 1 and never discounts it. (Required for schema symmetry with a finding's likelihood; the written value is not read by the score.)"
          },
          "code": {
            "type": "string",
            "description": "Stable rule identifier (e.g. \"repeated-null-check\") for rule-based filtering, suppression, and cross-run dedup \u2014 mirrors the finding field of the same name."
          },
          "code_url": {
            "type": "string",
            "format": "uri",
            "description": "URL documenting the rule named by code."
          },
          "finding_codes": {
            "type": "array",
            "items": {
              "type": "string"
            },
            "description": "The `code` values of the findings this systemic problem ties together, when those findings carry codes."
          },
          "paths": {
            "type": "array",
            "items": {
              "type": "string"
            },
            "description": "Repo-relative file paths the systemic problem spans."
          },
          "id": {
            "type": "string",
            "description": "Stable mechanism identifier \u2014 see the findings-level `id` note; the legacy reader maps it from `code`."
          },
          "finding_ids": {
            "type": "array",
            "items": {
              "type": "string"
            },
            "description": "The tolerant-in spelling of `finding_codes` (0.10 renamed it)."
          }
        }
      }
    },
    "scope_metastasis": {
      "type": "object",
      "additionalProperties": false,
      "description": "Advisory (issue #150): the mechanisms whose findings recurred in consecutive prior full-review rounds \u2014 per-code consecutive-round counts plus a decision prompt. The review agent does NOT write this field: the commenter re-derives it from the carried round history and delivers it in the prior review context of a re-review. When it is present, respond to the decision prompt \u2014 state in your summary whether you are committing to the expanding scope (planning the remaining facets of the recurring mechanism(s) as one unit) or narrowing the scope \u2014 so the decision is made explicitly rather than left to emerge piecemeal.",
      "required": [
        "decision_prompt",
        "recurring"
      ],
      "properties": {
        "decision_prompt": {
          "type": "string",
          "description": "The scope decision to make in the summary of the next review \u2014 a decision, not a directive."
        },
        "recurring": {
          "type": "array",
          "description": "The mechanisms flagged: one entry per code whose findings recurred in `consecutive_rounds` or more consecutive completed full-review rounds.",
          "items": {
            "type": "object",
            "additionalProperties": false,
            "required": [
              "consecutive_rounds",
              "start_round"
            ],
            "properties": {
              "code": {
                "type": "string",
                "description": "The finding code of the recurring mechanism."
              },
              "consecutive_rounds": {
                "type": "integer",
                "minimum": 1,
                "maximum": 9007199254740991,
                "description": "How many consecutive completed full-review rounds (ending at the last completed round) carried a finding with this code. Same-head CI retries are collapsed by the streak detector, so this is the de-duplicated streak, not the raw span: it may be less than `round - start_round + 1` when the history contains retries."
              },
              "start_round": {
                "type": "integer",
                "minimum": 1,
                "maximum": 9007199254740991,
                "description": "The 1-indexed round where the consecutive streak began."
              },
              "id": {
                "type": "string",
                "description": "The tolerant-in spelling of `code` (0.10 renamed it)."
              }
            },
            "anyOf": [
              {
                "required": [
                  "code"
                ],
                "properties": {
                  "code": {
                    "type": "string"
                  }
                }
              },
              {
                "required": [
                  "id"
                ],
                "properties": {
                  "id": {
                    "type": "string"
                  }
                }
              }
            ]
          }
        }
      }
    },
    "convergence": {
      "type": "object",
      "additionalProperties": false,
      "description": "Advisory (issue #174): the current round's convergence score, the threshold it is judged against, whether it converged, and the per-round trajectory. The review agent does NOT write this field \u2014 the pipeline computes the score deterministically from the findings (floor(severity) + headroom \u00d7 confidence \u00d7 likelihood, summed) and stamps it, so this JSON document is the sole source of the convergence data a decoding agent reads. `score` and `threshold` are both carried so the number is interpretable on its own (converged when score <= threshold); prior rounds are carried verbatim, so changing the threshold never rewrites a past round's score.",
      "required": [
        "score",
        "threshold",
        "converged"
      ],
      "properties": {
        "score": {
          "type": "number",
          "description": "This round's convergence score \u2014 the sum of every finding's and systemic problem's contribution, rounded to 2 decimals. Lower is closer to convergence."
        },
        "threshold": {
          "type": "number",
          "description": "The convergence tolerance in force for this round: the round is converged when score <= threshold."
        },
        "converged": {
          "type": "boolean",
          "description": "Whether this round converged (score <= threshold). Advisory only \u2014 never alters the verdict."
        },
        "rounds": {
          "type": "array",
          "description": "The convergence trajectory: one entry per completed full-review round, oldest first, this round's entry last. Each score is a historical snapshot carried verbatim.",
          "items": {
            "type": "object",
            "additionalProperties": false,
            "required": [
              "round"
            ],
            "properties": {
              "round": {
                "type": "integer",
                "minimum": 1,
                "description": "The 1-indexed completed-round number this entry represents."
              },
              "score": {
                "type": "number",
                "description": "That round's convergence score, carried verbatim from when the round completed. Absent only for a round migrated from a pre-#174 sticky, which stored no score."
              },
              "codes": {
                "type": "object",
                "additionalProperties": {
                  "type": "integer",
                  "minimum": 0
                },
                "description": "That round's mechanism-frequency map: finding code -> number of findings carrying it. Feeds the same-mechanism and scope-metastasis recurrence signals."
              },
              "sha": {
                "type": "string",
                "description": "The reviewed head SHA (short form) for that round, so a same-head CI retry is recognised as the same iteration rather than new recurrence evidence."
              },
              "ids": {
                "type": "object",
                "additionalProperties": {
                  "type": "integer",
                  "minimum": 0
                },
                "description": "The tolerant-in spelling of `codes` (0.10 renamed the round's mechanism map to `ids`)."
              }
            }
          }
        }
      }
    },
    "change_size": {
      "type": "object",
      "additionalProperties": false,
      "description": "Best-effort (issue #182): the change's added/removed line counts bucketed by ROLE. Fill this with a LOW-effort path heuristic, no file introspection: a file under a tests directory or matching *.test.* / *_test.* is `tests`; a *.md file, anything under docs/, or a license/config doc is `docs`; everything else is `code`. Sum the diff's added and removed lines per bucket. Omit a role that did not change, or omit the whole field if you cannot estimate it. Chrome only \u2014 never affects the verdict or the convergence score. (The per-language cloc table shown beside it is supplied deterministically by the pipeline, not by you.)",
      "properties": {
        "code": {
          "type": "object",
          "additionalProperties": false,
          "required": [
            "added",
            "removed"
          ],
          "properties": {
            "added": {
              "type": "integer",
              "minimum": 0
            },
            "removed": {
              "type": "integer",
              "minimum": 0
            }
          }
        },
        "tests": {
          "type": "object",
          "additionalProperties": false,
          "required": [
            "added",
            "removed"
          ],
          "properties": {
            "added": {
              "type": "integer",
              "minimum": 0
            },
            "removed": {
              "type": "integer",
              "minimum": 0
            }
          }
        },
        "docs": {
          "type": "object",
          "additionalProperties": false,
          "required": [
            "added",
            "removed"
          ],
          "properties": {
            "added": {
              "type": "integer",
              "minimum": 0
            },
            "removed": {
              "type": "integer",
              "minimum": 0
            }
          }
        }
      }
    },
    "findings": {
      "type": "array",
      "description": "Zero or more specific findings.",
      "items": {
        "type": "object",
        "additionalProperties": false,
        "required": [
          "path",
          "start_line",
          "end_line",
          "severity",
          "title",
          "description",
          "reasoning",
          "confidence",
          "likelihood"
        ],
        "properties": {
          "path": {
            "type": "string",
            "description": "Repo-relative file path the finding anchors to."
          },
          "start_line": {
            "type": "integer",
            "minimum": 1,
            "description": "1-indexed first line of the anchored range (post-change state when side is RIGHT)."
          },
          "end_line": {
            "type": "integer",
            "minimum": 1,
            "description": "1-indexed last line of the range; MUST be >= start_line. A suggestion replaces exactly start_line..end_line."
          },
          "side": {
            "type": "string",
            "enum": [
              "RIGHT",
              "LEFT"
            ],
            "default": "RIGHT",
            "description": "As in a unified-diff view: RIGHT for added/changed lines, LEFT for removed lines."
          },
          "severity": {
            "type": "string",
            "enum": [
              "critical",
              "major",
              "minor",
              "nit"
            ],
            "description": "Used for grouping and for folding nits into a collapsed section."
          },
          "code": {
            "type": "string",
            "description": "Stable rule identifier (e.g. \"null-check-missing\") for rule-based filtering, suppression, and cross-run dedup."
          },
          "code_url": {
            "type": "string",
            "format": "uri",
            "description": "URL documenting the rule named by code."
          },
          "title": {
            "type": "string",
            "description": "One-line summary of the finding."
          },
          "description": {
            "type": "string",
            "description": "1-3 sentence markdown explanation of what is wrong. Details belong in `reasoning`."
          },
          "recommendation": {
            "type": "string",
            "description": "1-2 sentence markdown prose describing what to do about the finding \u2014 distinct from `patch`, which is a machine-applicable unified diff. Use this when the fix is best explained rather than mechanically applied, or to accompany a `patch` with rationale."
          },
          "confidence": {
            "type": "number",
            "minimum": 0,
            "maximum": 1,
            "description": "0..1 confidence; a commenter MAY suppress findings below a configurable threshold to control noise, but MUST NOT suppress a critical-severity finding on confidence alone."
          },
          "likelihood": {
            "type": "number",
            "minimum": 0,
            "maximum": 1,
            "description": "0..1 probability the triggering input or state actually occurs in practice \u2014 from a normal user in routine use, OR from an adversary who chooses it when the finding is a security issue. Distinct from confidence (which rates whether the defect is real): a footgun that fires only on hostile-to-oneself input is high-confidence yet low-likelihood. Anchors: 0.9 = any normal input, or any input an attacker can choose (e.g. an injectable query parameter); 0.5 = a plausible-but-uncommon configuration; 0.1 = a genuinely obscure state no one seeks; 0.02 = requires deliberately hostile-to-oneself input (e.g. naming a struct field \"__slots__\"). Name the triggering input, then rate how routinely it occurs."
          },
          "reasoning": {
            "type": "string",
            "description": "Rationale/evidence for why the finding holds, so a human or downstream agent can judge its soundness \u2014 distinct from `description`, which explains the finding to the reader."
          },
          "patch": {
            "type": "string",
            "description": "Optional single-hunk unified diff of one mechanical fix to this file, expressed against its current (post-change) content \u2014 e.g. the `git diff` of just that edit after you apply it. It MUST be exactly one hunk and one contiguous change, and its context and removed lines MUST match the file verbatim so it applies cleanly. Omit this field when there is no clean mechanical fix \u2014 never invent one; put prose guidance in `recommendation` instead."
          },
          "id": {
            "type": "string",
            "description": "Stable mechanism identifier \u2014 0.10 renamed `code` to `id` and made it required. The frozen legacy schema accepts the tolerant-in `id` spelling too, so the ajv gate agrees with the legacy codec on the hybrid doc a mid-transition reviewer produces (new field, old version stamp)."
          }
        }
      }
    }
  }
}
