{
  "schema_version": "0.4.0",
  "summary": "Adds a retry wrapper comment and updates the config type. The change is focused and minimal.",
  "verdict": "comment",
  "findings": [
    {
      "path": "src/upload/config.ts",
      "start_line": 4,
      "end_line": 4,
      "side": "RIGHT",
      "severity": "major",
      "code": "widened-type",
      "code_url": "https://example.com/rules/widened-type",
      "title": "timeout type changed from number to number | string",
      "description": "Changing `timeout` from `number` to `number | string` widens the type. Callers that assumed a number will now need coercion.",
      "recommendation": "Keep `timeout: number` and add a `parseTimeout` helper at the edge that coerces string inputs.",
      "reasoning": "Every call site that does arithmetic on `timeout` now type-errors or silently coerces; the diff widens the type without updating those callers.",
      "confidence": 0.85,
      "likelihood": 1
    },
    {
      "path": "src/upload/client.ts",
      "start_line": 14,
      "end_line": 14,
      "side": "RIGHT",
      "severity": "nit",
      "title": "Vague comment: 'retry wrapper'",
      "description": "The comment `// retry wrapper` doesn't explain what is wrapped or why.",
      "reasoning": "A future reader can't tell from the comment what the wrapper retries or under what conditions; the retry logic is several lines above.",
      "confidence": 0.6,
      "likelihood": 1
    },
    {
      "path": "src/upload/__init__.py",
      "start_line": 3,
      "end_line": 3,
      "side": "RIGHT",
      "severity": "minor",
      "title": "__all__ should include all public names",
      "description": "If `LegacyClient` is still part of the public API, it should be in `__all__`. If not, remove the import.",
      "reasoning": "The import is present but absent from `__all__`, so `from pkg import *` won't export it — a likely oversight given it's imported at the package root.",
      "confidence": 0.7,
      "likelihood": 1
    },
    {
      "path": "src/legacy/old_code.ts",
      "start_line": 999,
      "end_line": 999,
      "side": "RIGHT",
      "severity": "minor",
      "title": "This line is NOT in the diff — should be demoted",
      "description": "This finding anchors to a line that is not in the diff. The inline command must demote it to the summary.",
      "reasoning": "The anchored line falls outside every diff hunk, so it cannot be posted as an inline comment and must appear in the strays section instead.",
      "confidence": 0.5,
      "likelihood": 1
    }
  ]
}
