{
  "schema_version": "0.4.0",
  "summary": "Authoritative: from the agent-written file.",
  "verdict": "comment",
  "findings": [
    {
      "path": "src/upload.ts",
      "start_line": 10,
      "end_line": 12,
      "side": "RIGHT",
      "severity": "minor",
      "title": "Missing null check",
      "description": "The `file` parameter may be undefined; add a guard before use.",
      "reasoning": "The handler dereferences `file` before any null check, and the caller can pass undefined.",
      "confidence": 0.7,
      "likelihood": 1,
      "id": "f11-agent-file-0"
    }
  ]
}
